{
  "$schema": "http://json-schema.org/draft-07/schema#",
  "type": "object",
  "properties": {
    "isActive": {
      "type": "boolean"
    },
    "name": {
      "type": "string"
    },
    "level_key": {
      "type": ["string", "null"]
    },
    "id": {
      "type": "integer"
    },
    "createdAt": {
      "type": "string",
      "format": "date-time"
    },
    "updatedAt": {
      "type": "string",
      "format": "date-time"
    },
    "deletedAt": {
      "type": ["string", "null"],
      "format": "date-time"
    }
  },
  "required": ["isActive", "name", "id", "createdAt", "updatedAt"]
}
